{
  "schema_version": 1,
  "operation_id": "64c8d9b2-431a-4fb6-9a8b-59efe066c621",
  "operation": "record_reassessment_modernization",
  "pilot_id": "primary-legacy-v1",
  "work_id": "grand-budapest-hotel-2014",
  "outcome": "completed",
  "expected_ledger_digest": "sha256:c9ea68b9afe0358b4c78fa726683a5275f41ba189575deed99f0f9f2a3e1dd93",
  "expected_work_digest": "sha256:9ade70d0a290cd63b0de99488499178d1b439322cf0f0a3d2e9517f42e31e13e",
  "metadata_operation_id": "0be2c98d-ea42-4ec1-a28f-fc674627cc65",
  "semantic_operation_id": "a41f3b62-27c8-4b61-a22c-e89731e9cf49",
  "vocabulary_digest": "sha256:523339428874178b77f5fb6bec5b4d0ef3bf2415d666c1a064f1b19d31651378"
}
