{
  "operation": "record_reassessment_modernization",
  "schema_version": 1,
  "operation_id": "d4643fd1-9c2a-4861-a919-97dee8ae8bac",
  "pilot_id": "primary-legacy-v1",
  "work_id": "gattaca-1997",
  "outcome": "completed",
  "expected_ledger_digest": "sha256:4448c391c57661dc74d4db8aa385de4813e9d488bcbbb7856d7d24715e54d5b4",
  "expected_work_digest": "sha256:170dee00c006ddb2c2c92d4c6e5eb7f95719330f4ec465084a01297e362b1b27",
  "metadata_operation_id": "81a3147e-c334-400f-bec7-8762273e51c6",
  "semantic_operation_id": "c7537ded-c1de-4789-bd3f-84472eda1f6a",
  "vocabulary_digest": "sha256:523339428874178b77f5fb6bec5b4d0ef3bf2415d666c1a064f1b19d31651378"
}
